<?xml version="1.0" encoding="UTF-8"?>
<!DOCTYPE cv SYSTEM "cv.dtd">
<cv>
  <lang></lang>
  <info>
    <full_name></full_name>
    <dob></dob>
    <address>
      <line1></line1>
      <line2></line2>
    </address>
    <tlf></tlf>
    <email></email>
    <github></github>
    <intro></intro>
  </info>
  <works>
    <section_title></section_title>
    <work>
      <dates>
        <start></start>
        <end></end>
      </dates>
      <location></location>
      <employer></employer>
      <position></position>
      <description></description>
    </work>
  </works>
  <learns>
    <section_title></section_title>
    <learn>
      <date>
        <start></start>
        <end></end>
      </date>
      <location></location>
      <institution></institution>
      <title></title>
      <grade></grade>
      <description></description>
    </learn>
  </learns>
  <skills>
    <section_title></section_title>
    <skill>
      <level></level>
      <name></name>
      <specificites></specificites>
      <description></description>
    </skill>
  </skills>
  <miscs>
    <section_title></section_title>
    <misc>
      <name></name>
      <description></description>
    </misc>
  </miscs>
</cv>
